{
  "schema_version": "v0",
  "id": "rec_0003",
  "component": "summarizer",
  "provider": "gemini",
  "model": "gemini-2.5-flash",
  "started_at": "2026-10-12T14:07:10.500Z",
  "latency": { "total_ms": 1432 },
  "usage": { "input_tokens": 2750, "output_tokens": 310 },
  "source": { "type": "import_jsonl" }
}
